### ISSUE TITLE
vagrant setup not work as expected...

### ISSUE THREAD

**Issue by mcarbonneaux** [github/glb-director#102]
i've configured as https://github.com/github/glb-director/blob/master/docs/setup/example-setup-vagrant.md.

i've shutdowned director2 that use xdp and use dpdk.

when i use curl from user machine... i go in timeout...

when i use curl from router machine they work but...  the ip source that are seen front proxy are 192.168.50.1, in place of 192.168.50.2 why ?

and when try from user machine they use the same ip (192.168.50.1) as ip source in place of 192.168.40.x source ip, and cannot reply to user machine beceause that machine not have the 192.168.50 network... 

what are missing ? why glb-director not correctly encapsulate the source ip ?

this ip are not configured any where (no default route any where! but exist on 192.168.50 network because of virtual network as host ip interface)....

```
vagrant@proxy1:~$ tshark -ni any port not 22 and not arp and port not 547 and not stp
Capturing on 'any'
    1 0.000000000 192.168.50.1 ? 10.10.10.10  TCP 116 37924 ? 80 [SYN] Seq=0 Win=64240 Len=0 MSS=1460 SACK_PERM=1 TSval=1513029862 TSecr=0 WS=64
    2 0.000000000 192.168.50.1 ? 10.10.10.10  TCP 76 [TCP Out-Of-Order] 37924 ? 80 [SYN] Seq=0 Win=64240 Len=0 MSS=1460 SACK_PERM=1 TSval=1513029862 TSecr=0 WS=64
    3 0.000051246  10.10.10.10 ? 192.168.50.1 TCP 76 80 ? 37924 [SYN, ACK] Seq=0 Ack=1 Win=65160 Len=0 MSS=1460 SACK_PERM=1 TSval=1575348520 TSecr=1513029862 WS=64
    4 0.000255767 192.168.50.1 ? 10.10.10.10  TCP 108 37924 ? 80 [ACK] Seq=1 Ack=1 Win=64256 Len=0 TSval=1513029862 TSecr=1575348520
    5 0.000255767 192.168.50.1 ? 10.10.10.10  TCP 68 [TCP Dup ACK 4#1] 37924 ? 80 [ACK] Seq=1 Ack=1 Win=64256 Len=0 TSval=1513029862 TSecr=1575348520
    6 0.000373384 192.168.50.1 ? 10.10.10.10  HTTP 183 GET / HTTP/1.1
    7 0.000373384 192.168.50.1 ? 10.10.10.10  TCP 143 [TCP Retransmission] 37924 ? 80 [PSH, ACK] Seq=1 Ack=1 Win=64256 Len=75 TSval=1513029862 TSecr=1575348520
    8 0.000391393  10.10.10.10 ? 192.168.50.1 TCP 68 80 ? 37924 [ACK] Seq=1 Ack=76 Win=65088 Len=0 TSval=1575348520 TSecr=1513029862
    9 0.000574828  10.10.10.10 ? 192.168.50.1 HTTP 336 HTTP/1.1 200 OK  (text/html)
   10 0.000756007 192.168.50.1 ? 10.10.10.10  TCP 108 37924 ? 80 [ACK] Seq=76 Ack=269 Win=64128 Len=0 TSval=1513029863 TSecr=1575348521
   11 0.000756007 192.168.50.1 ? 10.10.10.10  TCP 68 [TCP Dup ACK 10#1] 37924 ? 80 [ACK] Seq=76 Ack=269 Win=64128 Len=0 TSval=1513029863 TSecr=1575348521
   12 0.001064636 192.168.50.1 ? 10.10.10.10  TCP 108 37924 ? 80 [FIN, ACK] Seq=76 Ack=269 Win=64128 Len=0 TSval=1513029863 TSecr=1575348521
   13 0.001064636 192.168.50.1 ? 10.10.10.10  TCP 68 [TCP Out-Of-Order] 37924 ? 80 [FIN, ACK] Seq=76 Ack=269 Win=64128 Len=0 TSval=1513029863 TSecr=1575348521
   14 0.001100476  10.10.10.10 ? 192.168.50.1 TCP 68 80 ? 37924 [FIN, ACK] Seq=269 Ack=77 Win=65088 Len=0 TSval=1575348521 TSecr=1513029863
   15 0.001311342 192.168.50.1 ? 10.10.10.10  TCP 108 37924 ? 80 [ACK] Seq=77 Ack=270 Win=64128 Len=0 TSval=1513029863 TSecr=1575348521
   16 0.001311342 192.168.50.1 ? 10.10.10.10  TCP 68 [TCP Dup ACK 15#1] 37924 ? 80 [ACK] Seq=77 Ack=270 Win=64128 Len=0 TSval=1513029863 TSecr=1575348521
```

**Comment by mcarbonneaux** [comment]
with director2 (xdp) up and director1 (dpdk) down...

from router machine they use the correct ip source (192.168.50.2)...
```
vagrant@router:~$ tshark -ni any  port 80
Capturing on 'any'
    1 0.000000000 192.168.50.2 ? 10.10.10.10  TCP 76 38322 ? 80 [SYN] Seq=0 Win=64240 Len=0 MSS=1460 SACK_PERM=1 TSval=1516482778 TSecr=0 WS=64
    2 0.000471599  10.10.10.10 ? 192.168.50.2 TCP 76 80 ? 38322 [SYN, ACK] Seq=0 Ack=1 Win=65160 Len=0 MSS=1460 SACK_PERM=1 TSval=19274601 TSecr=1516482778 WS=64
    3 0.000489387 192.168.50.2 ? 10.10.10.10  TCP 68 38322 ? 80 [ACK] Seq=1 Ack=1 Win=64256 Len=0 TSval=1516482779 TSecr=19274601
    4 0.000542381 192.168.50.2 ? 10.10.10.10  HTTP 143 GET / HTTP/1.1
    5 0.000867880  10.10.10.10 ? 192.168.50.2 TCP 68 80 ? 38322 [ACK] Seq=1 Ack=76 Win=65088 Len=0 TSval=19274601 TSecr=1516482779
    6 0.001019662  10.10.10.10 ? 192.168.50.2 HTTP 336 HTTP/1.1 200 OK  (text/html)
    7 0.001026502 192.168.50.2 ? 10.10.10.10  TCP 68 38322 ? 80 [ACK] Seq=76 Ack=269 Win=64128 Len=0 TSval=1516482779 TSecr=19274601
    8 0.001344224 192.168.50.2 ? 10.10.10.10  TCP 68 38322 ? 80 [FIN, ACK] Seq=76 Ack=269 Win=64128 Len=0 TSval=1516482780 TSecr=19274601
    9 0.001622499  10.10.10.10 ? 192.168.50.2 TCP 68 80 ? 38322 [FIN, ACK] Seq=269 Ack=77 Win=65088 Len=0 TSval=19274602 TSecr=1516482780
   10 0.001633818 192.168.50.2 ? 10.10.10.10  TCP 68 38322 ? 80 [ACK] Seq=77 Ack=270 Win=64128 Len=0 TSval=1516482780 TSecr=19274602

```

from users machine they use 192.168.40.1 in place of the 192.168.40 interface ip...
```
vagrant@router:~$ tshark -ni any  port 80
Capturing on 'any'
    1 0.000000000 192.168.40.1 ? 10.10.10.10  TCP 76 50582 ? 80 [SYN] Seq=0 Win=64240 Len=0 MSS=1460 SACK_PERM=1 TSval=2878135395 TSecr=0 WS=64
    2 0.000020589 192.168.40.1 ? 10.10.10.10  TCP 76 [TCP Out-Of-Order] 50582 ? 80 [SYN] Seq=0 Win=64240 Len=0 MSS=1460 SACK_PERM=1 TSval=2878135395 TSecr=0 WS=64
    3 1.023768887 192.168.40.1 ? 10.10.10.10  TCP 76 [TCP Retransmission] 50582 ? 80 [SYN] Seq=0 Win=64240 Len=0 MSS=1460 SACK_PERM=1 TSval=2878136419 TSecr=0 WS=64
    4 1.023788343 192.168.40.1 ? 10.10.10.10  TCP 76 [TCP Retransmission] 50582 ? 80 [SYN] Seq=0 Win=64240 Len=0 MSS=1460 SACK_PERM=1 TSval=2878136419 TSecr=0 WS=64
    5 3.039760686 192.168.40.1 ? 10.10.10.10  TCP 76 [TCP Retransmission] 50582 ? 80 [SYN] Seq=0 Win=64240 Len=0 MSS=1460 SACK_PERM=1 TSval=2878138435 TSecr=0 WS=64
    6 3.039773700 192.168.40.1 ? 10.10.10.10  TCP 76 [TCP Retransmission] 50582 ? 80 [SYN] Seq=0 Win=64240 Len=0 MSS=1460 SACK_PERM=1 TSval=2878138435 TSecr=0 WS=64
```

**Comment by mcarbonneaux** [comment]
i've found... is beacause libvirt create there vm with default gateway on the ssh part of vagrant, and all network are nat network with dhcp...
the first ip of each network can route traffic...
with my pr her: https://github.com/github/glb-director/pull/105 
they resolve the problem.
